{
  "$schema": "https://tecp.dev/policy-registry.schema.json",
  "version": "1.0",
  "description": "TECP Policy Registry - Machine-readable policy definitions with compliance mappings",
  "policies": {
    "no_retention": {
      "description": "Data is not stored after processing completes - ephemeral execution only",
      "enforcement_type": "design",
      "machine_check": "ephemeral_execution",
      "compliance_tags": ["GDPR.Art17", "CCPA.1798.105", "HIPAA.164.530"],
      "technical_details": "Execution environment destroyed after processing with cryptographic key erasure"
    },
    "eu_region": {
      "description": "Processing occurs within European Union jurisdiction",
      "enforcement_type": "infrastructure", 
      "machine_check": "region_constraint",
      "compliance_tags": ["GDPR.Art44", "GDPR.Art45", "EU.DataGovernanceAct"],
      "technical_details": "Infrastructure attestation proves geographic location of processing"
    },
    "no_export_pii": {
      "description": "Personally identifiable information is filtered from outputs",
      "enforcement_type": "code_audit",
      "machine_check": "output_filter",
      "compliance_tags": ["GDPR.Art4", "HIPAA.164.514", "CCPA.1798.140"],
      "technical_details": "Code audit proves PII detection and filtering mechanisms"
    },
    "hipaa_safe": {
      "description": "Processing meets HIPAA Safe Harbor requirements for PHI",
      "enforcement_type": "code_audit",
      "machine_check": "phi_anonymization",
      "compliance_tags": ["HIPAA.164.514", "HIPAA.164.502"],
      "technical_details": "Implements HIPAA Safe Harbor de-identification methods"
    },
    "ttl_5s": {
      "description": "Processing environment destroyed within 5 seconds maximum",
      "enforcement_type": "runtime",
      "machine_check": "temporal_bound",
      "compliance_tags": ["Custom.Ephemeral.UltraShort"],
      "technical_details": "Cryptographic timer enforces maximum execution lifetime"
    },
    "ttl_60s": {
      "description": "Processing environment destroyed within 60 seconds maximum",
      "enforcement_type": "runtime", 
      "machine_check": "temporal_bound",
      "compliance_tags": ["Custom.Ephemeral.Short"],
      "technical_details": "Cryptographic timer enforces maximum execution lifetime"
    },
    "ttl_300s": {
      "description": "Processing environment destroyed within 5 minutes maximum",
      "enforcement_type": "runtime",
      "machine_check": "temporal_bound", 
      "compliance_tags": ["Custom.Ephemeral.Standard"],
      "technical_details": "Cryptographic timer enforces maximum execution lifetime"
    },
    "key_erasure": {
      "description": "Cryptographic keys irreversibly destroyed after use",
      "enforcement_type": "cryptographic",
      "machine_check": "key_destruction_proof",
      "compliance_tags": ["FIPS.140-2", "CC.FCS_CKM", "NIST.SP800-57"],
      "technical_details": "Monotonic counters or cryptographic accumulators prove key destruction"
    },
    "no_model_training": {
      "description": "Input data is not used for machine learning model training",
      "enforcement_type": "code_audit",
      "machine_check": "training_prohibition", 
      "compliance_tags": ["AI.Ethics", "GDPR.Art22", "EU.AI.Act"],
      "technical_details": "Code audit proves no gradient updates or model parameter changes"
    },
    "audit_trail": {
      "description": "Complete audit trail of data processing steps maintained",
      "enforcement_type": "design",
      "machine_check": "provenance_chain",
      "compliance_tags": ["SOX.404", "GDPR.Art30", "HIPAA.164.312"],
      "technical_details": "Cryptographic chain of custody with immutable audit log"
    },
    "no_front_running": {
      "description": "Financial data processing prevents front-running opportunities",
      "enforcement_type": "runtime",
      "machine_check": "trading_isolation",
      "compliance_tags": ["MiFID.Art27", "SEC.Rule606", "CFTC.Part43"],
      "technical_details": "Temporal isolation prevents information leakage to trading systems"
    },
    "mifid_compliant": {
      "description": "Processing meets MiFID II transaction reporting requirements",
      "enforcement_type": "code_audit",
      "machine_check": "mifid_reporting",
      "compliance_tags": ["MiFID.Art26", "MiFID.Art27", "ESMA.RTS22"],
      "technical_details": "Automated compliance reporting with regulatory-required fields"
    },
    "fair_access": {
      "description": "Market data processing provides fair access without preferential treatment",
      "enforcement_type": "runtime",
      "machine_check": "access_equality",
      "compliance_tags": ["SEC.RegNMS", "MiFID.Art18", "IOSCO.Principles"],
      "technical_details": "Queue-based processing ensures temporal fairness"
    },
    "no_price_manipulation": {
      "description": "Trading analysis prevents price manipulation opportunities",
      "enforcement_type": "code_audit", 
      "machine_check": "manipulation_detection",
      "compliance_tags": ["SEC.Rule10b-5", "CFTC.Part180", "MAR.Art15"],
      "technical_details": "Analysis algorithms audited for manipulation detection and prevention"
    },
    "test_env": {
      "description": "Processing occurs in test/development environment (not production)",
      "enforcement_type": "infrastructure",
      "machine_check": "environment_classification",
      "compliance_tags": ["Custom.Testing"],
      "technical_details": "Infrastructure attestation confirms non-production environment"
    }
  },
  "compliance_frameworks": {
    "GDPR": {
      "name": "General Data Protection Regulation",
      "jurisdiction": "EU",
      "url": "https://gdpr.eu/",
      "key_articles": {
        "Art4": "Definitions of personal data",
        "Art17": "Right to erasure (right to be forgotten)",
        "Art22": "Automated individual decision-making",
        "Art30": "Records of processing activities", 
        "Art44": "General principle for transfers",
        "Art45": "Transfers on the basis of an adequacy decision"
      }
    },
    "HIPAA": {
      "name": "Health Insurance Portability and Accountability Act",
      "jurisdiction": "US",
      "url": "https://www.hhs.gov/hipaa/",
      "key_sections": {
        "164.502": "Uses and disclosures of PHI",
        "164.514": "De-identification of PHI",
        "164.530": "Administrative requirements"
      }
    },
    "MiFID": {
      "name": "Markets in Financial Instruments Directive",
      "jurisdiction": "EU",
      "url": "https://www.esma.europa.eu/policy-rules/mifid-ii-and-mifir",
      "key_articles": {
        "Art18": "Best execution",
        "Art26": "Investment advice",
        "Art27": "Portfolio management"
      }
    },
    "pci_dss_compliant": {
      "description": "Payment Card Industry Data Security Standard compliance",
      "enforcement_type": "infrastructure",
      "machine_check": "pci_environment_check",
      "compliance_tags": ["PCI.DSS.3.2.1", "PCI.DSS.Req3", "PCI.DSS.Req4"],
      "technical_details": "Secure cardholder data environment with encryption and access controls",
      "regulatory_framework": "PCI DSS",
      "key_requirements": {
        "Req3": "Protect stored cardholder data",
        "Req4": "Encrypt transmission of cardholder data",
        "Req7": "Restrict access by business need-to-know"
      }
    },
    "sox_compliant": {
      "description": "Sarbanes-Oxley Act compliance for financial reporting",
      "enforcement_type": "runtime",
      "machine_check": "sox_audit_trail",
      "compliance_tags": ["SOX.Section302", "SOX.Section404", "PCAOB.AS2201"],
      "technical_details": "Automated audit trails and internal controls over financial reporting",
      "regulatory_framework": "SOX",
      "key_requirements": {
        "Section302": "Corporate responsibility for financial reports",
        "Section404": "Management assessment of internal controls",
        "Section409": "Real-time disclosure requirements"
      }
    },
    "iso27001_compliant": {
      "description": "ISO 27001 Information Security Management System compliance",
      "enforcement_type": "design",
      "machine_check": "isms_controls_check",
      "compliance_tags": ["ISO27001.A.10.1", "ISO27001.A.12.3", "ISO27001.A.18.1"],
      "technical_details": "Information security controls and risk management framework",
      "regulatory_framework": "ISO 27001",
      "key_controls": {
        "A.10.1": "Cryptographic controls",
        "A.12.3": "Information backup",
        "A.18.1": "Compliance with legal requirements"
      }
    },
    "gdpr_art6_lawful": {
      "description": "GDPR Article 6 lawful basis for processing established",
      "enforcement_type": "code_audit",
      "machine_check": "lawful_basis_validation",
      "compliance_tags": ["GDPR.Art6.1a", "GDPR.Art6.1b", "GDPR.Art6.1f"],
      "technical_details": "Automated validation of lawful basis before data processing",
      "regulatory_framework": "GDPR",
      "key_articles": {
        "Art6.1a": "Consent",
        "Art6.1b": "Contract performance",
        "Art6.1f": "Legitimate interests"
      }
    },
    "ccpa_opt_out": {
      "description": "CCPA consumer right to opt-out of sale respected",
      "enforcement_type": "runtime",
      "machine_check": "opt_out_status_check",
      "compliance_tags": ["CCPA.1798.120", "CCPA.1798.135"],
      "technical_details": "Real-time validation of consumer opt-out preferences",
      "regulatory_framework": "CCPA",
      "key_provisions": {
        "1798.120": "Right to opt-out of sale",
        "1798.135": "Opt-out method requirements"
      }
    }
  },
  "enforcement_types": {
    "design": "Policy enforced through system architecture and design",
    "infrastructure": "Policy enforced through infrastructure configuration and attestation",
    "code_audit": "Policy enforced through audited code implementation",
    "runtime": "Policy enforced through runtime monitoring and controls",